Microsoft Windows [版本 6.1.7601]
版权所有 (c) 2009 Microsoft Corporation。保留所有权利。

C:\Users\sige>mysql  -uroot -p
Enter password: ******
Welcome to the MySQL monitor.  Commands end with ; or \g.
Your MySQL connection id is 3
Server version: 5.6.17 MySQL Community Server (GPL)

Copyright (c) 2000, 2014, Oracle and/or its affiliates. All rights reserved.

Oracle is a registered trademark of Oracle Corporation and/or its
affiliates. Other names may be trademarks of their respective
owners.

Type 'help;' or '\h' for help. Type '\c' to clear the current input statement.

mysql> show  databases;
+--------------------+
| Database           |
+--------------------+
| information_schema |
| mysql              |
| performance_schema |
| test               |
+--------------------+
4 rows in set (0.00 sec)

mysql>
mysql> create database  bbs;
Query OK, 1 row affected (0.00 sec)

mysql> show  databases;
+--------------------+
| Database           |
+--------------------+
| information_schema |
| bbs                |
| mysql              |
| performance_schema |
| test               |
+--------------------+
5 rows in set (0.01 sec)

mysql> use bbs;
Database changed
mysql>
mysql> create table user(id int,username varchar(40),password varchar(32));
Query OK, 0 rows affected (0.90 sec)

mysql> show tables;
+---------------+
| Tables_in_bbs |
+---------------+
| user          |
+---------------+
1 row in set (0.00 sec)

mysql> show  create table user;
+-------+-----------------------------------------------------------------------
--------------------------------------------------------------------------------
-----------------+
| Table | Create Table

                 |
+-------+-----------------------------------------------------------------------
--------------------------------------------------------------------------------
-----------------+
| user  | CREATE TABLE `user` (
  `id` int(11) DEFAULT NULL,
  `username` varchar(40) DEFAULT NULL,
  `password` varchar(32) DEFAULT NULL
) ENGINE=InnoDB DEFAULT CHARSET=latin1 |
+-------+-----------------------------------------------------------------------
--------------------------------------------------------------------------------
-----------------+
1 row in set (0.00 sec)

mysql> show create database bbs;
+----------+----------------------------------------------------------------+
| Database | Create Database                                                |
+----------+----------------------------------------------------------------+
| bbs      | CREATE DATABASE `bbs` /*!40100 DEFAULT CHARACTER SET latin1 */ |
+----------+----------------------------------------------------------------+
1 row in set (0.00 sec)

mysql> drop tables user;
Query OK, 0 rows affected (0.48 sec)

mysql> show tables;
Empty set (0.00 sec)

mysql> create table user(id int(12), username varchar(40) ,password varchar(32))
;
Query OK, 0 rows affected (0.82 sec)

mysql> desc  user;
+----------+-------------+------+-----+---------+-------+
| Field    | Type        | Null | Key | Default | Extra |
+----------+-------------+------+-----+---------+-------+
| id       | int(12)     | YES  |     | NULL    |       |
| username | varchar(40) | YES  |     | NULL    |       |
| password | varchar(32) | YES  |     | NULL    |       |
+----------+-------------+------+-----+---------+-------+
3 rows in set (0.03 sec)

mysql> alter  table user change password pass varchar(45);
Query OK, 0 rows affected (1.63 sec)
Enregistrements: 0  Doublons: 0  Avertissements: 0

mysql> desc  user;
+----------+-------------+------+-----+---------+-------+
| Field    | Type        | Null | Key | Default | Extra |
+----------+-------------+------+-----+---------+-------+
| id       | int(12)     | YES  |     | NULL    |       |
| username | varchar(40) | YES  |     | NULL    |       |
| pass     | varchar(45) | YES  |     | NULL    |       |
+----------+-------------+------+-----+---------+-------+
3 rows in set (0.01 sec)

mysql> alter table user change username name varchar(35);
Query OK, 0 rows affected (1.57 sec)
Enregistrements: 0  Doublons: 0  Avertissements: 0

mysql> desc  user;
+-------+-------------+------+-----+---------+-------+
| Field | Type        | Null | Key | Default | Extra |
+-------+-------------+------+-----+---------+-------+
| id    | int(12)     | YES  |     | NULL    |       |
| name  | varchar(35) | YES  |     | NULL    |       |
| pass  | varchar(45) | YES  |     | NULL    |       |
+-------+-------------+------+-----+---------+-------+
3 rows in set (0.02 sec)

mysql> alter table user drop pass;
Query OK, 0 rows affected (1.46 sec)
Enregistrements: 0  Doublons: 0  Avertissements: 0

mysql> desc  user;
+-------+-------------+------+-----+---------+-------+
| Field | Type        | Null | Key | Default | Extra |
+-------+-------------+------+-----+---------+-------+
| id    | int(12)     | YES  |     | NULL    |       |
| name  | varchar(35) | YES  |     | NULL    |       |
+-------+-------------+------+-----+---------+-------+
2 rows in set (0.02 sec)

mysql> alter table user add pass varchar(32) first;
Query OK, 0 rows affected (0.92 sec)
Enregistrements: 0  Doublons: 0  Avertissements: 0

mysql> desc  user;
+-------+-------------+------+-----+---------+-------+
| Field | Type        | Null | Key | Default | Extra |
+-------+-------------+------+-----+---------+-------+
| pass  | varchar(32) | YES  |     | NULL    |       |
| id    | int(12)     | YES  |     | NULL    |       |
| name  | varchar(35) | YES  |     | NULL    |       |
+-------+-------------+------+-----+---------+-------+
3 rows in set (0.02 sec)

mysql> alter table user drop pass;
Query OK, 0 rows affected (0.90 sec)
Enregistrements: 0  Doublons: 0  Avertissements: 0

mysql> desc  user;
+-------+-------------+------+-----+---------+-------+
| Field | Type        | Null | Key | Default | Extra |
+-------+-------------+------+-----+---------+-------+
| id    | int(12)     | YES  |     | NULL    |       |
| name  | varchar(35) | YES  |     | NULL    |       |
+-------+-------------+------+-----+---------+-------+
2 rows in set (0.02 sec)

mysql> alter table user add pass varchar(32) after name;
Query OK, 0 rows affected (1.42 sec)
Enregistrements: 0  Doublons: 0  Avertissements: 0

mysql> desc  user;
+-------+-------------+------+-----+---------+-------+
| Field | Type        | Null | Key | Default | Extra |
+-------+-------------+------+-----+---------+-------+
| id    | int(12)     | YES  |     | NULL    |       |
| name  | varchar(35) | YES  |     | NULL    |       |
| pass  | varchar(32) | YES  |     | NULL    |       |
+-------+-------------+------+-----+---------+-------+
3 rows in set (0.02 sec)

mysql> alter table user rename user_table;
Query OK, 0 rows affected (0.30 sec)

mysql> show databases;
+--------------------+
| Database           |
+--------------------+
| information_schema |
| bbs                |
| mysql              |
| performance_schema |
| test               |
+--------------------+
5 rows in set (0.00 sec)

mysql> use  bbs;
Database changed
mysql> show tables;
+---------------+
| Tables_in_bbs |
+---------------+
| user_table    |
+---------------+
1 row in set (0.00 sec)

Microsoft Windows [版本 6.1.7601]
版权所有 (c) 2009 Microsoft Corporation。保留所有权利。

C:\Users\sige>mysql -uroot  -p
Enter password: ******
Welcome to the MySQL monitor.  Commands end with ; or \g.
Your MySQL connection id is 4
Server version: 5.6.17 MySQL Community Server (GPL)

Copyright (c) 2000, 2014, Oracle and/or its affiliates. All rights reserved.

Oracle is a registered trademark of Oracle Corporation and/or its
affiliates. Other names may be trademarks of their respective
owners.

Type 'help;' or '\h' for help. Type '\c' to clear the current input statement.

mysql> use bbs;
Database changed
mysql> show tables;
+---------------+
| Tables_in_bbs |
+---------------+
| user_table    |
+---------------+
1 row in set (0.00 sec)

mysql> desc user_table;
+-------+-------------+------+-----+---------+-------+
| Field | Type        | Null | Key | Default | Extra |
+-------+-------------+------+-----+---------+-------+
| id    | int(12)     | YES  |     | NULL    |       |
| name  | varchar(35) | YES  |     | NULL    |       |
| pass  | varchar(32) | YES  |     | NULL    |       |
+-------+-------------+------+-----+---------+-------+
3 rows in set (0.02 sec)

mysql> alter table user_table modify name varchar(40);
Query OK, 0 rows affected (1.99 sec)
Enregistrements: 0  Doublons: 0  Avertissements: 0

mysql> desc user_table;
+-------+-------------+------+-----+---------+-------+
| Field | Type        | Null | Key | Default | Extra |
+-------+-------------+------+-----+---------+-------+
| id    | int(12)     | YES  |     | NULL    |       |
| name  | varchar(40) | YES  |     | NULL    |       |
| pass  | varchar(32) | YES  |     | NULL    |       |
+-------+-------------+------+-----+---------+-------+
3 rows in set (0.02 sec)

Microsoft Windows [版本 6.1.7601]
版权所有 (c) 2009 Microsoft Corporation。保留所有权利。

C:\Users\sige>mysql -uroot -p
Enter password: ******
Welcome to the MySQL monitor.  Commands end with ; or \g.
Your MySQL connection id is 1
Server version: 5.6.17 MySQL Community Server (GPL)

Copyright (c) 2000, 2014, Oracle and/or its affiliates. All rights reserved.

Oracle is a registered trademark of Oracle Corporation and/or its
affiliates. Other names may be trademarks of their respective
owners.

Type 'help;' or '\h' for help. Type '\c' to clear the current input statement.

mysql>
mysql> show  databases;
+--------------------+
| Database           |
+--------------------+
| information_schema |
| bbs                |
| mysql              |
| performance_schema |
| test               |
+--------------------+
5 rows in set (0.00 sec)

mysql>
mysql>
mysql> use bbs;
Database changed
mysql> show  tables;
+---------------+
| Tables_in_bbs |
+---------------+
| bbs_user      |
+---------------+
1 row in set (0.00 sec)

mysql>
mysql>
mysql> desc  bbs_user;
+----------+--------------+------+-----+---------+----------------+
| Field    | Type         | Null | Key | Default | Extra          |
+----------+--------------+------+-----+---------+----------------+
| id       | int(11)      | NO   | PRI | NULL    | auto_increment |
| username | varchar(45)  | NO   |     | NULL    |                |
| password | char(32)     | NO   |     | NULL    |                |
| age      | tinyint(3)   | NO   |     | NULL    |                |
| email    | varchar(45)  | NO   |     | NULL    |                |
| address  | varchar(255) | NO   |     | NULL    |                |
+----------+--------------+------+-----+---------+----------------+
6 rows in set (0.02 sec)

mysql> alter table bbs_user add index(age);
Query OK, 0 rows affected (0.72 sec)
Enregistrements: 0  Doublons: 0  Avertissements: 0

mysql> desc  bbs_user;
+----------+--------------+------+-----+---------+----------------+
| Field    | Type         | Null | Key | Default | Extra          |
+----------+--------------+------+-----+---------+----------------+
| id       | int(11)      | NO   | PRI | NULL    | auto_increment |
| username | varchar(45)  | NO   |     | NULL    |                |
| password | char(32)     | NO   |     | NULL    |                |
| age      | tinyint(3)   | NO   | MUL | NULL    |                |
| email    | varchar(45)  | NO   |     | NULL    |                |
| address  | varchar(255) | NO   |     | NULL    |                |
+----------+--------------+------+-----+---------+----------------+
6 rows in set (0.02 sec)

mysql> alter table bbs_user add  unique(password);
Query OK, 0 rows affected (0.87 sec)
Enregistrements: 0  Doublons: 0  Avertissements: 0

mysql> desc  bbs_user;
+----------+--------------+------+-----+---------+----------------+
| Field    | Type         | Null | Key | Default | Extra          |
+----------+--------------+------+-----+---------+----------------+
| id       | int(11)      | NO   | PRI | NULL    | auto_increment |
| username | varchar(45)  | NO   |     | NULL    |                |
| password | char(32)     | NO   | UNI | NULL    |                |
| age      | tinyint(3)   | NO   | MUL | NULL    |                |
| email    | varchar(45)  | NO   |     | NULL    |                |
| address  | varchar(255) | NO   |     | NULL    |                |
+----------+--------------+------+-----+---------+----------------+
6 rows in set (0.02 sec)

mysql> alter table bbs_user add  fulltext(address);
Query OK, 0 rows affected, 1 warning (6.15 sec)
Enregistrements: 0  Doublons: 0  Avertissements: 1

mysql> desc  bbs_user;
+----------+--------------+------+-----+---------+----------------+
| Field    | Type         | Null | Key | Default | Extra          |
+----------+--------------+------+-----+---------+----------------+
| id       | int(11)      | NO   | PRI | NULL    | auto_increment |
| username | varchar(45)  | NO   |     | NULL    |                |
| password | char(32)     | NO   | UNI | NULL    |                |
| age      | tinyint(3)   | NO   | MUL | NULL    |                |
| email    | varchar(45)  | NO   |     | NULL    |                |
| address  | varchar(255) | NO   | MUL | NULL    |                |
+----------+--------------+------+-----+---------+----------------+
6 rows in set (0.02 sec)

mysql> show  index from  bbs_user;
+----------+------------+----------+--------------+-------------+-----------+---
----------+----------+--------+------+------------+---------+---------------+
| Table    | Non_unique | Key_name | Seq_in_index | Column_name | Collation | Ca
rdinality | Sub_part | Packed | Null | Index_type | Comment | Index_comment |
+----------+------------+----------+--------------+-------------+-----------+---
----------+----------+--------+------+------------+---------+---------------+
| bbs_user |          0 | PRIMARY  |            1 | id          | A         |
        0 |     NULL | NULL   |      | BTREE      |         |               |
| bbs_user |          0 | password |            1 | password    | A         |
        0 |     NULL | NULL   |      | BTREE      |         |               |
| bbs_user |          1 | age      |            1 | age         | A         |
        0 |     NULL | NULL   |      | BTREE      |         |               |
| bbs_user |          1 | address  |            1 | address     | NULL      |
        0 |     NULL | NULL   |      | FULLTEXT   |         |               |
+----------+------------+----------+--------------+-------------+-----------+---
----------+----------+--------+------+------------+---------+---------------+
4 rows in set (0.00 sec)

mysql> select database();
+------------+
| database() |
+------------+
| bbs        |
+------------+
1 row in set (0.00 sec)

Microsoft Windows [版本 6.1.7601]
版权所有 (c) 2009 Microsoft Corporation。保留所有权利。

C:\Users\sige>mysql -uroot -p
Enter password: ******
Welcome to the MySQL monitor.  Commands end with ; or \g.
Your MySQL connection id is 4
Server version: 5.6.17 MySQL Community Server (GPL)

Copyright (c) 2000, 2014, Oracle and/or its affiliates. All rights reserved.

Oracle is a registered trademark of Oracle Corporation and/or its
affiliates. Other names may be trademarks of their respective
owners.

Type 'help;' or '\h' for help. Type '\c' to clear the current input statement.

mysql>
mysql> show  databases;
+--------------------+
| Database           |
+--------------------+
| information_schema |
| bbs                |
| mysql              |
| performance_schema |
| test               |
+--------------------+
5 rows in set (0.00 sec)

mysql> use  bbs;
Database changed
mysql> show tables;
+---------------+
| Tables_in_bbs |
+---------------+
| bbs_user      |
+---------------+
1 row in set (0.00 sec)

mysql> desc  bbs_user;
+----------+--------------+------+-----+---------+----------------+
| Field    | Type         | Null | Key | Default | Extra          |
+----------+--------------+------+-----+---------+----------------+
| id       | int(11)      | NO   | PRI | NULL    | auto_increment |
| username | varchar(45)  | NO   |     | NULL    |                |
| password | char(32)     | NO   |     | NULL    |                |
| address  | varchar(255) | NO   |     | NULL    |                |
| sex      | tinyint(2)   | NO   |     | NULL    |                |
| age      | tinyint(3)   | NO   |     | NULL    |                |
+----------+--------------+------+-----+---------+----------------+
6 rows in set (0.02 sec)

mysql> insert into bbs_user values(1,'王宝强',123123,'河北邢台',1,18);
Query OK, 1 row affected (0.12 sec)

mysql> select * from bbs_user;
+----+----------+----------+----------+-----+-----+
| id | username | password | address  | sex | age |
+----+----------+----------+----------+-----+-----+
|  1 | 王宝强   | 123123   | 河北邢台 |   1 |  18 |
+----+----------+----------+----------+-----+-----+
1 row in set (0.00 sec)

mysql> insert into bbs_user(id, username, password,address,sex,age) values(2,'谢
霆锋',123,'香港',1,19);
Query OK, 1 row affected (0.36 sec)

mysql> select * from bbs_user;
+----+----------+----------+----------+-----+-----+
| id | username | password | address  | sex | age |
+----+----------+----------+----------+-----+-----+
|  1 | 王宝强   | 123123   | 河北邢台 |   1 |  18 |
|  2 | 谢霆锋   | 123      | 香港     |   1 |  19 |
+----+----------+----------+----------+-----+-----+
2 rows in set (0.00 sec)

mysql> insert into bbs_user(username, password,address,sex,age) values('张柏芝',
123,'香港',1,19);
Query OK, 1 row affected (0.34 sec)

mysql> select * from bbs_user;
+----+----------+----------+----------+-----+-----+
| id | username | password | address  | sex | age |
+----+----------+----------+----------+-----+-----+
|  1 | 王宝强   | 123123   | 河北邢台 |   1 |  18 |
|  2 | 谢霆锋   | 123      | 香港     |   1 |  19 |
|  3 | 张柏芝   | 123      | 香港     |   1 |  19 |
+----+----------+----------+----------+-----+-----+
3 rows in set (0.00 sec)

mysql> insert into bbs_user(username, password,address,sex,age) values('张柏芝',
123,'香港',1,19);
Query OK, 1 row affected (0.34 sec)

mysql> insert into bbs_user(username, password,address,sex,age) values('张柏芝',
123,'香港',1,19);
Query OK, 1 row affected (0.24 sec)

mysql> insert into bbs_user(username, password,address,sex,age) values('张柏芝',
123,'香港',1,19);
Query OK, 1 row affected (0.13 sec)

mysql> select * from bbs_user;
+----+----------+----------+----------+-----+-----+
| id | username | password | address  | sex | age |
+----+----------+----------+----------+-----+-----+
|  1 | 王宝强   | 123123   | 河北邢台 |   1 |  18 |
|  2 | 谢霆锋   | 123      | 香港     |   1 |  19 |
|  3 | 张柏芝   | 123      | 香港     |   1 |  19 |
|  4 | 张柏芝   | 123      | 香港     |   1 |  19 |
|  5 | 张柏芝   | 123      | 香港     |   1 |  19 |
|  6 | 张柏芝   | 123      | 香港     |   1 |  19 |
+----+----------+----------+----------+-----+-----+
6 rows in set (0.00 sec)

mysql> insert into bbs_user(username,password,address,sex,age) values('李连杰',4
56,'大陆',1,56);
Query OK, 1 row affected (0.34 sec)

mysql> select * from bbs_user;
+----+----------+----------+----------+-----+-----+
| id | username | password | address  | sex | age |
+----+----------+----------+----------+-----+-----+
|  1 | 王宝强   | 123123   | 河北邢台 |   1 |  18 |
|  2 | 谢霆锋   | 123      | 香港     |   1 |  19 |
|  3 | 张柏芝   | 123      | 香港     |   1 |  19 |
|  4 | 张柏芝   | 123      | 香港     |   1 |  19 |
|  5 | 张柏芝   | 123      | 香港     |   1 |  19 |
|  6 | 张柏芝   | 123      | 香港     |   1 |  19 |
|  7 | 李连杰   | 456      | 大陆     |   1 |  56 |
+----+----------+----------+----------+-----+-----+
7 rows in set (0.00 sec)

mysql> insert into bbs_user(username, password,address,sex,age) values('李四',45
6,'大陆',1,56),('成龙',789,'香港',1,55);
Query OK, 2 rows affected (0.34 sec)
Enregistrements: 2  Doublons: 0  Avertissements: 0

mysql> select * from bbs_user;
+----+----------+----------+----------+-----+-----+
| id | username | password | address  | sex | age |
+----+----------+----------+----------+-----+-----+
|  1 | 王宝强   | 123123   | 河北邢台 |   1 |  18 |
|  2 | 谢霆锋   | 123      | 香港     |   1 |  19 |
|  3 | 张柏芝   | 123      | 香港     |   1 |  19 |
|  4 | 张柏芝   | 123      | 香港     |   1 |  19 |
|  5 | 张柏芝   | 123      | 香港     |   1 |  19 |
|  6 | 张柏芝   | 123      | 香港     |   1 |  19 |
|  7 | 李连杰   | 456      | 大陆     |   1 |  56 |
|  8 | 李四     | 456      | 大陆     |   1 |  56 |
|  9 | 成龙     | 789      | 香港     |   1 |  55 |
+----+----------+----------+----------+-----+-----+
9 rows in set (0.00 sec)

mysql> insert into bbs_user(username,password,address,sex,age) values('李连杰',4
56,'大陆',1,56),('张三',345,'北京',1,17);
Query OK, 2 rows affected (0.16 sec)
Enregistrements: 2  Doublons: 0  Avertissements: 0

mysql> select * from bbs_user;
+----+----------+----------+----------+-----+-----+
| id | username | password | address  | sex | age |
+----+----------+----------+----------+-----+-----+
|  1 | 王宝强   | 123123   | 河北邢台 |   1 |  18 |
|  2 | 谢霆锋   | 123      | 香港     |   1 |  19 |
|  3 | 张柏芝   | 123      | 香港     |   1 |  19 |
|  4 | 张柏芝   | 123      | 香港     |   1 |  19 |
|  5 | 张柏芝   | 123      | 香港     |   1 |  19 |
|  6 | 张柏芝   | 123      | 香港     |   1 |  19 |
|  7 | 李连杰   | 456      | 大陆     |   1 |  56 |
|  8 | 李四     | 456      | 大陆     |   1 |  56 |
|  9 | 成龙     | 789      | 香港     |   1 |  55 |
| 10 | 李连杰   | 456      | 大陆     |   1 |  56 |
| 11 | 张三     | 345      | 北京     |   1 |  17 |
+----+----------+----------+----------+-----+-----+
11 rows in set (0.09 sec)

=====================================================
Microsoft Windows [版本 6.1.7601]
版权所有 (c) 2009 Microsoft Corporation。保留所有权利。

C:\Users\sige>mysql -uroot -p
Enter password: ******
Welcome to the MySQL monitor.  Commands end with ; or \g.
Your MySQL connection id is 6
Server version: 5.6.17 MySQL Community Server (GPL)

Copyright (c) 2000, 2014, Oracle and/or its affiliates. All rights reserved.

Oracle is a registered trademark of Oracle Corporation and/or its
affiliates. Other names may be trademarks of their respective
owners.

Type 'help;' or '\h' for help. Type '\c' to clear the current input statement.

mysql> show datbases;
ERROR 1064 (42000): Erreur de syntaxe près de 'datbases' à la ligne 1
mysql> show databases;
+--------------------+
| Database           |
+--------------------+
| information_schema |
| bbs                |
| mysql              |
| performance_schema |
| test               |
+--------------------+
5 rows in set (0.00 sec)

mysql> use bbs;
Database changed
mysql> show tables;
+---------------+
| Tables_in_bbs |
+---------------+
| bbs_user      |
+---------------+
1 row in set (0.00 sec)

mysql> select * from bbs_user;
+----+----------+----------+----------+-----+-----+
| id | username | password | address  | sex | age |
+----+----------+----------+----------+-----+-----+
|  1 | 王宝强   | 123123   | 河北邢台 |   1 |  18 |
|  2 | 谢霆锋   | 123      | 香港     |   1 |  19 |
|  3 | 张柏芝   | 123      | 香港     |   1 |  19 |
|  4 | 张柏芝   | 123      | 香港     |   1 |  19 |
|  5 | 张柏芝   | 123      | 香港     |   1 |  19 |
|  6 | 张柏芝   | 123      | 香港     |   1 |  19 |
|  7 | 李连杰   | 456      | 大陆     |   1 |  56 |
|  8 | 李四     | 456      | 大陆     |   1 |  56 |
|  9 | 成龙     | 789      | 香港     |   1 |  55 |
| 10 | 李连杰   | 456      | 大陆     |   1 |  56 |
| 11 | 张三     | 345      | 北京     |   1 |  17 |
+----+----------+----------+----------+-----+-----+
11 rows in set (0.00 sec)

mysql> delete from bbs_user where username = '张三';
Query OK, 1 row affected (0.17 sec)

mysql> select * from bbs_user;
+----+----------+----------+----------+-----+-----+
| id | username | password | address  | sex | age |
+----+----------+----------+----------+-----+-----+
|  1 | 王宝强   | 123123   | 河北邢台 |   1 |  18 |
|  2 | 谢霆锋   | 123      | 香港     |   1 |  19 |
|  3 | 张柏芝   | 123      | 香港     |   1 |  19 |
|  4 | 张柏芝   | 123      | 香港     |   1 |  19 |
|  5 | 张柏芝   | 123      | 香港     |   1 |  19 |
|  6 | 张柏芝   | 123      | 香港     |   1 |  19 |
|  7 | 李连杰   | 456      | 大陆     |   1 |  56 |
|  8 | 李四     | 456      | 大陆     |   1 |  56 |
|  9 | 成龙     | 789      | 香港     |   1 |  55 |
| 10 | 李连杰   | 456      | 大陆     |   1 |  56 |
+----+----------+----------+----------+-----+-----+
10 rows in set (0.00 sec)

mysql> update bbs_user set username='测试' where id=10;
Query OK, 1 row affected (0.36 sec)
Enregistrements correspondants: 1  Modifi茅s: 1  Warnings: 0

mysql> select * from bbs_user;
+----+----------+----------+----------+-----+-----+
| id | username | password | address  | sex | age |
+----+----------+----------+----------+-----+-----+
|  1 | 王宝强   | 123123   | 河北邢台 |   1 |  18 |
|  2 | 谢霆锋   | 123      | 香港     |   1 |  19 |
|  3 | 张柏芝   | 123      | 香港     |   1 |  19 |
|  4 | 张柏芝   | 123      | 香港     |   1 |  19 |
|  5 | 张柏芝   | 123      | 香港     |   1 |  19 |
|  6 | 张柏芝   | 123      | 香港     |   1 |  19 |
|  7 | 李连杰   | 456      | 大陆     |   1 |  56 |
|  8 | 李四     | 456      | 大陆     |   1 |  56 |
|  9 | 成龙     | 789      | 香港     |   1 |  55 |
| 10 | 测试     | 456      | 大陆     |   1 |  56 |
+----+----------+----------+----------+-----+-----+
10 rows in set (0.08 sec)

mysql> update bbs_user set username='小明',password='666666',address='星球' wher
e id=8;
Query OK, 1 row affected (0.14 sec)
Enregistrements correspondants: 1  Modifi茅s: 1  Warnings: 0

mysql> select * from bbs_user;
+----+----------+----------+----------+-----+-----+
| id | username | password | address  | sex | age |
+----+----------+----------+----------+-----+-----+
|  1 | 王宝强   | 123123   | 河北邢台 |   1 |  18 |
|  2 | 谢霆锋   | 123      | 香港     |   1 |  19 |
|  3 | 张柏芝   | 123      | 香港     |   1 |  19 |
|  4 | 张柏芝   | 123      | 香港     |   1 |  19 |
|  5 | 张柏芝   | 123      | 香港     |   1 |  19 |
|  6 | 张柏芝   | 123      | 香港     |   1 |  19 |
|  7 | 李连杰   | 456      | 大陆     |   1 |  56 |
|  8 | 小明     | 666666   | 星球     |   1 |  56 |
|  9 | 成龙     | 789      | 香港     |   1 |  55 |
| 10 | 测试     | 456      | 大陆     |   1 |  56 |
+----+----------+----------+----------+-----+-----+
10 rows in set (0.00 sec)

mysql> select * from bbs_user;
+----+----------+----------+----------+-----+-----+
| id | username | password | address  | sex | age |
+----+----------+----------+----------+-----+-----+
|  1 | 王宝强   | 123123   | 河北邢台 |   1 |  18 |
|  2 | 谢霆锋   | 123      | 香港     |   1 |  19 |
|  3 | 张柏芝   | 123      | 香港     |   1 |  19 |
|  4 | 张柏芝   | 123      | 香港     |   1 |  19 |
|  5 | 张柏芝   | 123      | 香港     |   1 |  19 |
|  6 | 张柏芝   | 123      | 香港     |   1 |  19 |
|  7 | 李连杰   | 456      | 大陆     |   1 |  56 |
|  8 | 小明     | 666666   | 星球     |   1 |  56 |
|  9 | 成龙     | 789      | 香港     |   1 |  55 |
| 10 | 测试     | 456      | 大陆     |   1 |  56 |
+----+----------+----------+----------+-----+-----+
10 rows in set (0.00 sec)

mysql> select username from bbs_user;
+----------+
| username |
+----------+
| 王宝强   |
| 谢霆锋   |
| 张柏芝   |
| 张柏芝   |
| 张柏芝   |
| 张柏芝   |
| 李连杰   |
| 小明     |
| 成龙     |
| 测试     |
+----------+
10 rows in set (0.00 sec)

mysql> select username,address from bbs_user;
+----------+----------+
| username | address  |
+----------+----------+
| 王宝强   | 河北邢台 |
| 谢霆锋   | 香港     |
| 张柏芝   | 香港     |
| 张柏芝   | 香港     |
| 张柏芝   | 香港     |
| 张柏芝   | 香港     |
| 李连杰   | 大陆     |
| 小明     | 星球     |
| 成龙     | 香港     |
| 测试     | 大陆     |
+----------+----------+
10 rows in set (0.00 sec)

mysql> select distinct address from bbs_user;
+----------+
| address  |
+----------+
| 河北邢台 |
| 香港     |
| 大陆     |
| 星球     |
+----------+
4 rows in set (0.09 sec)

mysql> select * from bbs_user;
+----+----------+----------+----------+-----+-----+
| id | username | password | address  | sex | age |
+----+----------+----------+----------+-----+-----+
|  1 | 王宝强   | 123123   | 河北邢台 |   1 |  18 |
|  2 | 谢霆锋   | 123      | 香港     |   1 |  19 |
|  3 | 张柏芝   | 123      | 香港     |   1 |  19 |
|  4 | 张柏芝   | 123      | 香港     |   1 |  19 |
|  5 | 张柏芝   | 123      | 香港     |   1 |  19 |
|  6 | 张柏芝   | 123      | 香港     |   1 |  19 |
|  7 | 李连杰   | 456      | 大陆     |   1 |  56 |
|  8 | 小明     | 666666   | 星球     |   1 |  56 |
|  9 | 成龙     | 789      | 香港     |   1 |  55 |
| 10 | 测试     | 456      | 大陆     |   1 |  56 |
+----+----------+----------+----------+-----+-----+
10 rows in set (0.00 sec)

mysql> select * from bbs_user where id=2;
+----+----------+----------+---------+-----+-----+
| id | username | password | address | sex | age |
+----+----------+----------+---------+-----+-----+
|  2 | 谢霆锋   | 123      | 香港    |   1 |  19 |
+----+----------+----------+---------+-----+-----+
1 row in set (0.00 sec)

mysql> select * from bbs_user where id>2;
+----+----------+----------+---------+-----+-----+
| id | username | password | address | sex | age |
+----+----------+----------+---------+-----+-----+
|  3 | 张柏芝   | 123      | 香港    |   1 |  19 |
|  4 | 张柏芝   | 123      | 香港    |   1 |  19 |
|  5 | 张柏芝   | 123      | 香港    |   1 |  19 |
|  6 | 张柏芝   | 123      | 香港    |   1 |  19 |
|  7 | 李连杰   | 456      | 大陆    |   1 |  56 |
|  8 | 小明     | 666666   | 星球    |   1 |  56 |
|  9 | 成龙     | 789      | 香港    |   1 |  55 |
| 10 | 测试     | 456      | 大陆    |   1 |  56 |
+----+----------+----------+---------+-----+-----+
8 rows in set (0.00 sec)

mysql> select * from bbs_user where id<2;
+----+----------+----------+----------+-----+-----+
| id | username | password | address  | sex | age |
+----+----------+----------+----------+-----+-----+
|  1 | 王宝强   | 123123   | 河北邢台 |   1 |  18 |
+----+----------+----------+----------+-----+-----+
1 row in set (0.00 sec)

Microsoft Windows [版本 6.1.7601]
版权所有 (c) 2009 Microsoft Corporation。保留所有权利。

C:\Users\sige>mysql  -uroot -p
Enter password: *****
ERROR 1045 (28000): Acc¨¨s refus¨¦ pour l'utilisateur: 'root'@'@localhost' (m
ot de passe: OUI)

C:\Users\sige>mysql  -uroot -p
Enter password: ******
Welcome to the MySQL monitor.  Commands end with ; or \g.
Your MySQL connection id is 12
Server version: 5.6.17 MySQL Community Server (GPL)

Copyright (c) 2000, 2014, Oracle and/or its affiliates. All rights reserved.

Oracle is a registered trademark of Oracle Corporation and/or its
affiliates. Other names may be trademarks of their respective
owners.

Type 'help;' or '\h' for help. Type '\c' to clear the current input statement.

mysql>
mysql>
mysql>
mysql> use bbs;
Database changed
mysql> select * from  bbs_user;
+----+----------+----------+----------+-----+-----+
| id | username | password | address  | sex | age |
+----+----------+----------+----------+-----+-----+
|  1 | 王宝强   | 123123   | 河北邢台 |   1 |  18 |
|  7 | 李连杰   | 456      | 大陆     |   1 |  50 |
|  8 | 赵六     | 456      | 河北     |   1 |  50 |
| 10 | 李霖     | 456      | 大陆     |   1 |  50 |
| 12 | 张三     | 345      | 北京     |   1 |  17 |
| 13 | 张柏芝   | 123      | 香港     |   0 |  20 |
| 14 | 谢霆锋   | 345      | 香港     |   1 |  33 |
| 15 | 陈冠希   | 678      | 香港     |   1 |  30 |
| 16 | 凤姐     | 789      | 美国     |   0 |  16 |
| 17 | 犀利哥   | 999      | 河北     |   1 |  40 |
+----+----------+----------+----------+-----+-----+
10 rows in set (0.00 sec)

mysql> select * from bbs_user where age between 30 and 40;
+----+----------+----------+---------+-----+-----+
| id | username | password | address | sex | age |
+----+----------+----------+---------+-----+-----+
| 14 | 谢霆锋   | 345      | 香港    |   1 |  33 |
| 15 | 陈冠希   | 678      | 香港    |   1 |  30 |
| 17 | 犀利哥   | 999      | 河北    |   1 |  40 |
+----+----------+----------+---------+-----+-----+
3 rows in set (0.09 sec)

mysql> select * from bbs_user where age=40 or age=50;
+----+----------+----------+---------+-----+-----+
| id | username | password | address | sex | age |
+----+----------+----------+---------+-----+-----+
|  7 | 李连杰   | 456      | 大陆    |   1 |  50 |
|  8 | 赵六     | 456      | 河北    |   1 |  50 |
| 10 | 李霖     | 456      | 大陆    |   1 |  50 |
| 17 | 犀利哥   | 999      | 河北    |   1 |  40 |
+----+----------+----------+---------+-----+-----+
4 rows in set (0.00 sec)

mysql> select * from bbs_user where age!=50;
+----+----------+----------+----------+-----+-----+
| id | username | password | address  | sex | age |
+----+----------+----------+----------+-----+-----+
|  1 | 王宝强   | 123123   | 河北邢台 |   1 |  18 |
| 12 | 张三     | 345      | 北京     |   1 |  17 |
| 13 | 张柏芝   | 123      | 香港     |   0 |  20 |
| 14 | 谢霆锋   | 345      | 香港     |   1 |  33 |
| 15 | 陈冠希   | 678      | 香港     |   1 |  30 |
| 16 | 凤姐     | 789      | 美国     |   0 |  16 |
| 17 | 犀利哥   | 999      | 河北     |   1 |  40 |
+----+----------+----------+----------+-----+-----+
7 rows in set (0.00 sec)

mysql> select * from bbs_user where age<>50;
+----+----------+----------+----------+-----+-----+
| id | username | password | address  | sex | age |
+----+----------+----------+----------+-----+-----+
|  1 | 王宝强   | 123123   | 河北邢台 |   1 |  18 |
| 12 | 张三     | 345      | 北京     |   1 |  17 |
| 13 | 张柏芝   | 123      | 香港     |   0 |  20 |
| 14 | 谢霆锋   | 345      | 香港     |   1 |  33 |
| 15 | 陈冠希   | 678      | 香港     |   1 |  30 |
| 16 | 凤姐     | 789      | 美国     |   0 |  16 |
| 17 | 犀利哥   | 999      | 河北     |   1 |  40 |
+----+----------+----------+----------+-----+-----+
7 rows in set (0.00 sec)

mysql> select * from bbs_user where age in(18,16,17);
+----+----------+----------+----------+-----+-----+
| id | username | password | address  | sex | age |
+----+----------+----------+----------+-----+-----+
|  1 | 王宝强   | 123123   | 河北邢台 |   1 |  18 |
| 12 | 张三     | 345      | 北京     |   1 |  17 |
| 16 | 凤姐     | 789      | 美国     |   0 |  16 |
+----+----------+----------+----------+-----+-----+
3 rows in set (0.00 sec)

mysql> select * from bbs_user where address like '%香';
Empty set (0.00 sec)

mysql> select * from bbs_user where address like '香%';
+----+----------+----------+---------+-----+-----+
| id | username | password | address | sex | age |
+----+----------+----------+---------+-----+-----+
| 13 | 张柏芝   | 123      | 香港    |   0 |  20 |
| 14 | 谢霆锋   | 345      | 香港    |   1 |  33 |
| 15 | 陈冠希   | 678      | 香港    |   1 |  30 |
+----+----------+----------+---------+-----+-----+
3 rows in set (0.00 sec)

mysql> select * from bbs_user where address like '%香%';
+----+----------+----------+---------+-----+-----+
| id | username | password | address | sex | age |
+----+----------+----------+---------+-----+-----+
| 13 | 张柏芝   | 123      | 香港    |   0 |  20 |
| 14 | 谢霆锋   | 345      | 香港    |   1 |  33 |
| 15 | 陈冠希   | 678      | 香港    |   1 |  30 |
+----+----------+----------+---------+-----+-----+
3 rows in set (0.00 sec)

mysql> select * from bbs_user where address like '%北%';
+----+----------+----------+----------+-----+-----+
| id | username | password | address  | sex | age |
+----+----------+----------+----------+-----+-----+
|  1 | 王宝强   | 123123   | 河北邢台 |   1 |  18 |
|  8 | 赵六     | 456      | 河北     |   1 |  50 |
| 12 | 张三     | 345      | 北京     |   1 |  17 |
| 17 | 犀利哥   | 999      | 河北     |   1 |  40 |
+----+----------+----------+----------+-----+-----+
4 rows in set (0.00 sec)

mysql> select * from bbs_user  order by age;
+----+----------+----------+----------+-----+-----+
| id | username | password | address  | sex | age |
+----+----------+----------+----------+-----+-----+
| 16 | 凤姐     | 789      | 美国     |   0 |  16 |
| 12 | 张三     | 345      | 北京     |   1 |  17 |
|  1 | 王宝强   | 123123   | 河北邢台 |   1 |  18 |
| 13 | 张柏芝   | 123      | 香港     |   0 |  20 |
| 15 | 陈冠希   | 678      | 香港     |   1 |  30 |
| 14 | 谢霆锋   | 345      | 香港     |   1 |  33 |
| 17 | 犀利哥   | 999      | 河北     |   1 |  40 |
| 10 | 李霖     | 456      | 大陆     |   1 |  50 |
|  8 | 赵六     | 456      | 河北     |   1 |  50 |
|  7 | 李连杰   | 456      | 大陆     |   1 |  50 |
+----+----------+----------+----------+-----+-----+
10 rows in set (0.00 sec)

mysql> select * from bbs_user  order by age desc;
+----+----------+----------+----------+-----+-----+
| id | username | password | address  | sex | age |
+----+----------+----------+----------+-----+-----+
|  7 | 李连杰   | 456      | 大陆     |   1 |  50 |
|  8 | 赵六     | 456      | 河北     |   1 |  50 |
| 10 | 李霖     | 456      | 大陆     |   1 |  50 |
| 17 | 犀利哥   | 999      | 河北     |   1 |  40 |
| 14 | 谢霆锋   | 345      | 香港     |   1 |  33 |
| 15 | 陈冠希   | 678      | 香港     |   1 |  30 |
| 13 | 张柏芝   | 123      | 香港     |   0 |  20 |
|  1 | 王宝强   | 123123   | 河北邢台 |   1 |  18 |
| 12 | 张三     | 345      | 北京     |   1 |  17 |
| 16 | 凤姐     | 789      | 美国     |   0 |  16 |
+----+----------+----------+----------+-----+-----+
10 rows in set (0.00 sec)

mysql> select * from bbs_user  order by age asc;
+----+----------+----------+----------+-----+-----+
| id | username | password | address  | sex | age |
+----+----------+----------+----------+-----+-----+
| 16 | 凤姐     | 789      | 美国     |   0 |  16 |
| 12 | 张三     | 345      | 北京     |   1 |  17 |
|  1 | 王宝强   | 123123   | 河北邢台 |   1 |  18 |
| 13 | 张柏芝   | 123      | 香港     |   0 |  20 |
| 15 | 陈冠希   | 678      | 香港     |   1 |  30 |
| 14 | 谢霆锋   | 345      | 香港     |   1 |  33 |
| 17 | 犀利哥   | 999      | 河北     |   1 |  40 |
| 10 | 李霖     | 456      | 大陆     |   1 |  50 |
|  8 | 赵六     | 456      | 河北     |   1 |  50 |
|  7 | 李连杰   | 456      | 大陆     |   1 |  50 |
+----+----------+----------+----------+-----+-----+
10 rows in set (0.00 sec)

mysql> select * from bbs_user limit 5,5;
+----+----------+----------+---------+-----+-----+
| id | username | password | address | sex | age |
+----+----------+----------+---------+-----+-----+
| 13 | 张柏芝   | 123      | 香港    |   0 |  20 |
| 14 | 谢霆锋   | 345      | 香港    |   1 |  33 |
| 15 | 陈冠希   | 678      | 香港    |   1 |  30 |
| 16 | 凤姐     | 789      | 美国    |   0 |  16 |
| 17 | 犀利哥   | 999      | 河北    |   1 |  40 |
+----+----------+----------+---------+-----+-----+
5 rows in set (0.00 sec)

mysql> select * from bbs_user limit 5,5;
+----+----------+----------+---------+-----+-----+
| id | username | password | address | sex | age |
+----+----------+----------+---------+-----+-----+
|  6 | 张柏芝   | 123      | 香港    |   0 |  20 |
|  7 | 谢霆锋   | 345      | 香港    |   1 |  33 |
|  8 | 陈冠希   | 678      | 香港    |   1 |  30 |
|  9 | 凤姐     | 789      | 美国    |   0 |  16 |
| 10 | 犀利哥   | 999      | 河北    |   1 |  40 |
+----+----------+----------+---------+-----+-----+
5 rows in set (0.00 sec)

mysql> select * from bbs_user limit 5,3;
+----+----------+----------+---------+-----+-----+
| id | username | password | address | sex | age |
+----+----------+----------+---------+-----+-----+
|  6 | 张柏芝   | 123      | 香港    |   0 |  20 |
|  7 | 谢霆锋   | 345      | 香港    |   1 |  33 |
|  8 | 陈冠希   | 678      | 香港    |   1 |  30 |
+----+----------+----------+---------+-----+-----+
3 rows in set (0.00 sec)

mysql> select * from bbs_user limit 3;
+----+----------+----------+----------+-----+-----+
| id | username | password | address  | sex | age |
+----+----------+----------+----------+-----+-----+
|  1 | 王宝强   | 123123   | 河北邢台 |   1 |  18 |
|  2 | 李连杰   | 456      | 大陆     |   1 |  50 |
|  3 | 赵六     | 456      | 河北     |   1 |  50 |
+----+----------+----------+----------+-----+-----+
3 rows in set (0.00 sec)

mysql> select * from bbs_user limit 0,3;
+----+----------+----------+----------+-----+-----+
| id | username | password | address  | sex | age |
+----+----------+----------+----------+-----+-----+
|  1 | 王宝强   | 123123   | 河北邢台 |   1 |  18 |
|  2 | 李连杰   | 456      | 大陆     |   1 |  50 |
|  3 | 赵六     | 456      | 河北     |   1 |  50 |
+----+----------+----------+----------+-----+-----+
3 rows in set (0.00 sec)

mysql> select * from bbs_user group by address;
+----+----------+----------+----------+-----+-----+
| id | username | password | address  | sex | age |
+----+----------+----------+----------+-----+-----+
|  5 | 张三     | 345      | 北京     |   1 |  17 |
|  2 | 李连杰   | 456      | 大陆     |   1 |  50 |
|  3 | 赵六     | 456      | 河北     |   1 |  50 |
|  1 | 王宝强   | 123123   | 河北邢台 |   1 |  18 |
|  9 | 凤姐     | 789      | 美国     |   0 |  16 |
|  6 | 张柏芝   | 123      | 香港     |   0 |  20 |
+----+----------+----------+----------+-----+-----+
6 rows in set (0.00 sec)

mysql> select count(*) from bbs_user;
+----------+
| count(*) |
+----------+
|       10 |
+----------+
1 row in set (0.09 sec)

mysql> select * from bbs_user;
+----+----------+----------+----------+-----+-----+
| id | username | password | address  | sex | age |
+----+----------+----------+----------+-----+-----+
|  1 | 王宝强   | 123123   | 河北邢台 |   1 |  18 |
|  2 | 李连杰   | 456      | 大陆     |   1 |  50 |
|  3 | 赵六     | 456      | 河北     |   1 |  50 |
|  4 | 李霖     | 456      | 大陆     |   1 |  50 |
|  5 | 张三     | 345      | 北京     |   1 |  17 |
|  6 | 张柏芝   | 123      | 香港     |   0 |  20 |
|  7 | 谢霆锋   | 345      | 香港     |   1 |  33 |
|  8 | 陈冠希   | 678      | 香港     |   1 |  30 |
|  9 | 凤姐     | 789      | 美国     |   0 |  16 |
| 10 | 犀利哥   | 999      | 河北     |   1 |  40 |
+----+----------+----------+----------+-----+-----+
10 rows in set (0.00 sec)

mysql> select username as name  from bbs_user;
+--------+
| name   |
+--------+
| 王宝强 |
| 李连杰 |
| 赵六   |
| 李霖   |
| 张三   |
| 张柏芝 |
| 谢霆锋 |
| 陈冠希 |
| 凤姐   |
| 犀利哥 |
+--------+
10 rows in set (0.00 sec)
=================================================
Microsoft Windows [版本 6.1.7601]
版权所有 (c) 2009 Microsoft Corporation。保留所有权利。

C:\Users\sige>mysql -uroot -p
Enter password: ******
Welcome to the MySQL monitor.  Commands end with ; or \g.
Your MySQL connection id is 19
Server version: 5.6.17 MySQL Community Server (GPL)

Copyright (c) 2000, 2014, Oracle and/or its affiliates. All rights reserved.

Oracle is a registered trademark of Oracle Corporation and/or its
affiliates. Other names may be trademarks of their respective
owners.

Type 'help;' or '\h' for help. Type '\c' to clear the current input statement.

mysql> use shop;
Database changed
mysql> show tables;
+----------------+
| Tables_in_shop |
+----------------+
| shop_goods     |
| shop_user      |
+----------------+
2 rows in set (0.00 sec)

mysql> select * from shop_user;
+----+----------+----------+-----+-----------+-----------+---------+-----+
| id | username | password | gid | ctime     | mail      | address | age |
+----+----------+----------+-----+-----------+-----------+---------+-----+
|  1 | 王宝强   | 123      | 1   | 190945224 | 11@qq.com | 北京    |  10 |
|  2 | 谢霆锋   | 345      | 2   | 190945224 | 22@qq.com | 上海    |  12 |
|  3 | 张三     | 223      | 2   | 190945224 | 33@qq.com | 北京    |  12 |
|  4 | 李霖     | 444      | 1   | 190945224 | 44@qq.com | 深圳    |  13 |
|  5 | 王五     | 333      | 1   | 190945224 | 55@qq.com | 深圳    |  11 |
|  6 | 赵六     | 1111     |     | 190945224 | 66@qq.com | 广州    |  11 |
|  7 | 麻子     | 222      | 1   | 190945224 | 77@qq.com | 杭州    |  14 |
+----+----------+----------+-----+-----------+-----------+---------+-----+
7 rows in set (0.00 sec)

mysql> select * from shop_user  where id=2;
+----+----------+----------+-----+-----------+-----------+---------+-----+
| id | username | password | gid | ctime     | mail      | address | age |
+----+----------+----------+-----+-----------+-----------+---------+-----+
|  2 | 谢霆锋   | 345      | 2   | 190945224 | 22@qq.com | 上海    |  12 |
+----+----------+----------+-----+-----------+-----------+---------+-----+
1 row in set (0.00 sec)

mysql> select * from shop_user group  by  address limit 0,2;
+----+----------+----------+-----+-----------+-----------+---------+-----+
| id | username | password | gid | ctime     | mail      | address | age |
+----+----------+----------+-----+-----------+-----------+---------+-----+
|  2 | 谢霆锋   | 345      | 2   | 190945224 | 22@qq.com | 上海    |  12 |
|  1 | 王宝强   | 123      | 1   | 190945224 | 11@qq.com | 北京    |  10 |
+----+----------+----------+-----+-----------+-----------+---------+-----+
2 rows in set (0.00 sec)

mysql> select * from shop_user group  by  address;
+----+----------+----------+-----+-----------+-----------+---------+-----+
| id | username | password | gid | ctime     | mail      | address | age |
+----+----------+----------+-----+-----------+-----------+---------+-----+
|  2 | 谢霆锋   | 345      | 2   | 190945224 | 22@qq.com | 上海    |  12 |
|  1 | 王宝强   | 123      | 1   | 190945224 | 11@qq.com | 北京    |  10 |
|  6 | 赵六     | 1111     |     | 190945224 | 66@qq.com | 广州    |  11 |
|  7 | 麻子     | 222      | 1   | 190945224 | 77@qq.com | 杭州    |  14 |
|  4 | 李霖     | 444      | 1   | 190945224 | 44@qq.com | 深圳    |  13 |
+----+----------+----------+-----+-----------+-----------+---------+-----+
5 rows in set (0.00 sec)

mysql> select * from shop_user where age>10  order by id desc;
+----+----------+----------+-----+-----------+-----------+---------+-----+
| id | username | password | gid | ctime     | mail      | address | age |
+----+----------+----------+-----+-----------+-----------+---------+-----+
|  7 | 麻子     | 222      | 1   | 190945224 | 77@qq.com | 杭州    |  14 |
|  6 | 赵六     | 1111     |     | 190945224 | 66@qq.com | 广州    |  11 |
|  5 | 王五     | 333      | 1   | 190945224 | 55@qq.com | 深圳    |  11 |
|  4 | 李霖     | 444      | 1   | 190945224 | 44@qq.com | 深圳    |  13 |
|  3 | 张三     | 223      | 2   | 190945224 | 33@qq.com | 北京    |  12 |
|  2 | 谢霆锋   | 345      | 2   | 190945224 | 22@qq.com | 上海    |  12 |
+----+----------+----------+-----+-----------+-----------+---------+-----+
6 rows in set (0.00 sec)

mysql> select * from shop_user where age>10  order by id desc limit 0,3;
+----+----------+----------+-----+-----------+-----------+---------+-----+
| id | username | password | gid | ctime     | mail      | address | age |
+----+----------+----------+-----+-----------+-----------+---------+-----+
|  7 | 麻子     | 222      | 1   | 190945224 | 77@qq.com | 杭州    |  14 |
|  6 | 赵六     | 1111     |     | 190945224 | 66@qq.com | 广州    |  11 |
|  5 | 王五     | 333      | 1   | 190945224 | 55@qq.com | 深圳    |  11 |
+----+----------+----------+-----+-----------+-----------+---------+-----+
3 rows in set (0.00 sec)

mysql> select username , gname from shop_user inner join shop_goods on shop_user
.gid=shop_goods.gid;
+----------+--------+
| username | gname  |
+----------+--------+
| 王宝强   | 铅笔   |
| 谢霆锋   | 橡皮   |
| 张三     | 橡皮   |
| 李霖     | 铅笔   |
| 王五     | 笔记本 |
| 麻子     | 铅笔   |
+----------+--------+
6 rows in set (0.27 sec)

mysql> select  shop_user.username from shop_user left join shop_goods on shop_us
er.gid=shop_goods.gid;
+----------+
| username |
+----------+
| 王宝强   |
| 谢霆锋   |
| 张三     |
| 李霖     |
| 王五     |
| 赵六     |
| 麻子     |
+----------+
7 rows in set (0.09 sec)

mysql> select  shop_user.username from shop_user right join shop_goods on shop_u
ser.gid=shop_goods.gid;
+----------+
| username |
+----------+
| 王宝强   |
| 谢霆锋   |
| 张三     |
| 李霖     |
| 王五     |
| 麻子     |
+----------+
6 rows in set (0.00 sec)

mysql> show  tables;
+----------------+
| Tables_in_shop |
+----------------+
| shop_goods     |
| shop_user      |
+----------------+
2 rows in set (0.00 sec)

mysql> desc shop_goods;
+-------+--------------+------+-----+---------+----------------+
| Field | Type         | Null | Key | Default | Extra          |
+-------+--------------+------+-----+---------+----------------+
| gid   | int(10)      | NO   | PRI | NULL    | auto_increment |
| gname | varchar(255) | NO   |     | NULL    |                |
| price | int(255)     | NO   |     | NULL    |                |
+-------+--------------+------+-----+---------+----------------+
3 rows in set (0.03 sec)

mysql> select * from  shop_goods;
+-----+--------+-------+
| gid | gname  | price |
+-----+--------+-------+
|   1 | 铅笔   |   100 |
|   2 | 橡皮   |   200 |
|   3 | 笔记本 |   300 |
+-----+--------+-------+
3 rows in set (0.00 sec)

mysql> desc shop_user;
+----------+--------------+------+-----+---------+----------------+
| Field    | Type         | Null | Key | Default | Extra          |
+----------+--------------+------+-----+---------+----------------+
| id       | int(11)      | NO   | PRI | NULL    | auto_increment |
| username | varchar(45)  | NO   |     | NULL    |                |
| password | char(32)     | NO   |     | NULL    |                |
| gid      | varchar(255) | NO   |     | NULL    |                |
| ctime    | varchar(60)  | NO   |     | NULL    |                |
| mail     | varchar(255) | NO   |     | NULL    |                |
| address  | varchar(255) | NO   |     | NULL    |                |
| age      | tinyint(3)   | NO   |     | NULL    |                |
+----------+--------------+------+-----+---------+----------------+
8 rows in set (0.02 sec)

mysql> select * from  shop_user;
+----+----------+----------+-----+-----------+-----------+---------+-----+
| id | username | password | gid | ctime     | mail      | address | age |
+----+----------+----------+-----+-----------+-----------+---------+-----+
|  1 | 王宝强   | 123      | 1   | 190945224 | 11@qq.com | 北京    |  10 |
|  2 | 谢霆锋   | 345      | 2   | 190945224 | 22@qq.com | 上海    |  12 |
|  3 | 张三     | 223      | 2   | 190945224 | 33@qq.com | 北京    |  12 |
|  4 | 李霖     | 444      | 1   | 190945224 | 44@qq.com | 深圳    |  13 |
|  5 | 王五     | 333      | 3   | 190945224 | 55@qq.com | 深圳    |  11 |
|  6 | 赵六     | 1111     |     | 190945224 | 66@qq.com | 广州    |  11 |
|  7 | 麻子     | 222      | 1   | 190945224 | 77@qq.com | 杭州    |  14 |
+----+----------+----------+-----+-----------+-----------+---------+-----+
7 rows in set (0.00 sec)

mysql> select * from  shop_user where gid in(select gid from shop_goods);
+----+----------+----------+-----+-----------+-----------+---------+-----+
| id | username | password | gid | ctime     | mail      | address | age |
+----+----------+----------+-----+-----------+-----------+---------+-----+
|  1 | 王宝强   | 123      | 1   | 190945224 | 11@qq.com | 北京    |  10 |
|  2 | 谢霆锋   | 345      | 2   | 190945224 | 22@qq.com | 上海    |  12 |
|  3 | 张三     | 223      | 2   | 190945224 | 33@qq.com | 北京    |  12 |
|  4 | 李霖     | 444      | 1   | 190945224 | 44@qq.com | 深圳    |  13 |
|  5 | 王五     | 333      | 3   | 190945224 | 55@qq.com | 深圳    |  11 |
|  7 | 麻子     | 222      | 1   | 190945224 | 77@qq.com | 杭州    |  14 |
+----+----------+----------+-----+-----------+-----------+---------+-----+
6 rows in set (0.28 sec)

mysql> select * from  shop_user where gid in(1,2,3);
+----+----------+----------+-----+-----------+-----------+---------+-----+
| id | username | password | gid | ctime     | mail      | address | age |
+----+----------+----------+-----+-----------+-----------+---------+-----+
|  1 | 王宝强   | 123      | 1   | 190945224 | 11@qq.com | 北京    |  10 |
|  2 | 谢霆锋   | 345      | 2   | 190945224 | 22@qq.com | 上海    |  12 |
|  3 | 张三     | 223      | 2   | 190945224 | 33@qq.com | 北京    |  12 |
|  4 | 李霖     | 444      | 1   | 190945224 | 44@qq.com | 深圳    |  13 |
|  5 | 王五     | 333      | 3   | 190945224 | 55@qq.com | 深圳    |  11 |
|  7 | 麻子     | 222      | 1   | 190945224 | 77@qq.com | 杭州    |  14 |
+----+----------+----------+-----+-----------+-----------+---------+-----+
6 rows in set (0.00 sec)

